{
  "$schema": "http://json-schema.org/draft-07/schema#",
  "title": "Template Pack Schema",
  "description": "Schema for Choyce Engine template packs",
  "type": "object",
  "properties": {
    "template_id": {
      "type": "string",
      "description": "Unique identifier for the template"
    },
    "name": {
      "type": "string",
      "description": "English name of the template"
    },
    "name_pl": {
      "type": "string",
      "description": "Polish name of the template"
    },
    "description_pl": {
      "type": "string",
      "description": "Polish description of the template"
    },
    "theme": {
      "type": "string",
      "description": "Theme category (business, adventure, etc.)"
    },
    "default_palette_id": {
      "type": "string",
      "description": "Default color palette identifier"
    },
    "palette_options": {
      "type": "array",
      "items": {
        "type": "string"
      },
      "description": "Available color palette identifiers"
    },
    "difficulty": {
      "type": "string",
      "description": "Difficulty level (easy, medium, hard)"
    },
    "estimated_playtime_min": {
      "type": "integer",
      "description": "Estimated playtime in minutes"
    },
    "tags_pl": {
      "type": "array",
      "items": {
        "type": "string"
      },
      "description": "Polish tags for categorization"
    },
    "suggested_age": {
      "type": "string",
      "description": "Suggested age range"
    },
    "default_world": {
      "type": "object",
      "properties": {
        "name_pl": {
          "type": "string",
          "description": "Polish name for the default world"
        },
        "nodes": {
          "type": "array",
          "items": {
            "type": "object",
            "properties": {
              "type": {
                "type": "string",
                "description": "Node type (TERRAIN, OBJECT, etc.)"
              },
              "display_name_pl": {
                "type": "string",
                "description": "Polish display name"
              },
              "position": {
                "type": "array",
                "items": {
                  "type": "number"
                },
                "minItems": 3,
                "maxItems": 3,
                "description": "X, Y, Z position"
              },
              "properties": {
                "type": "object",
                "description": "Extensible node properties (color, mesh_type, size, etc.)"
              }
            },
            "required": ["type", "display_name_pl", "position"]
          }
        },
        "rules": {
          "type": "array",
          "items": {
            "type": "object",
            "properties": {
              "type": {
                "type": "string",
                "description": "Rule type (TIMER, SCORE, etc.)"
              },
              "display_name_pl": {
                "type": "string",
                "description": "Polish display name"
              },
              "compiled_logic": {
                "type": "string",
                "description": "Compiled rule logic"
              }
            },
            "required": ["type", "display_name_pl"]
          }
        }
      },
      "required": ["name_pl"]
    },
    "onboarding_hints_pl": {
      "type": "array",
      "items": {
        "type": "string"
      },
      "description": "Polish onboarding hints"
    },
    "quest_text_pl": {
      "type": "array",
      "items": {
        "type": "string"
      },
      "description": "Polish quest text snippets"
    },
    "quests": {
      "type": "array",
      "items": {
        "type": "object",
        "properties": {
          "quest_id": {
            "type": "string"
          },
          "title_pl": {
            "type": "string"
          },
          "description_pl": {
            "type": "string"
          },
          "objective_type": {
            "type": "string"
          },
          "target_count": {
            "type": "integer"
          },
          "reward_score": {
            "type": "integer"
          },
          "reward_unlocks": {
            "type": "array",
            "items": {
              "type": "string"
            }
          }
        },
        "required": ["quest_id", "title_pl", "description_pl", "objective_type", "target_count"]
      }
    },
    "default_goal": {
      "type": "object",
      "description": "Primary win goal shown in the Quest HUD. Maps 1:1 onto GameGoal kinds (collect, enter_zone, talk, build_count).",
      "properties": {
        "kind": { "type": "string", "enum": ["collect", "enter_zone", "talk", "build_count"] },
        "target": { "type": "integer", "minimum": 1 },
        "label_pl": { "type": "string" },
        "icon_id": { "type": "string" },
        "win_condition": { "type": "string", "description": "WinConditionInterpreter DSL expression, e.g. 'inventory.key>=3' or 'in_zone.finish==true'." }
      },
      "required": ["kind", "target", "label_pl", "win_condition"]
    },
    "lose_conditions": {
      "type": "object",
      "description": "Session-end lose triggers. Parent-tunable via ParentalPolicy.",
      "properties": {
        "lives": { "type": "integer", "minimum": 1, "description": "Total respawns before lose." },
        "time_limit_sec": { "type": "integer", "minimum": 0, "description": "Session timeout; 0 disables." },
        "kill_plane_y": { "type": "number", "description": "Y-coordinate below which the player falls and triggers respawn/lose." }
      }
    }
  },
  "required": ["template_id", "name_pl", "default_world"]
}
